{
  "schema": 1,
  "_meta": {"source":"maxpreps","url":"https://www.maxpreps.com/tx/kaufman/kaufman-lions","asOf":null},
  "id": "5b5c9c50-be4f-44be-8b7c-4d005ebb82bb",
  "name": "Kaufman",
  "fullName": null,
  "city": "Kaufman",
  "state": "TX",
  "maxpreps": "https://www.maxpreps.com/tx/kaufman/kaufman-lions",
  "summary": {"appearances":1,"titles":0,"finals":0,"w":0,"l":1,"d":0},
  "best": {"season":"2025-26","competition":"tx-uil","division":"5a-d2","divisionLabel":"Conference 5A D2","result":"eliminated","reached":"Bi-District"},
  "appearances": [
    {"season":"2025-26","state":"TX","competition":"tx-uil","division":"5a-d2","divisionLabel":"Conference 5A D2","gender":"girls","seed":null,"rounds":6,"w":0,"l":1,"d":0,"gf":0,"ga":2,"games":[{"round":0,"roundName":"Bi-District","date":"2026-03-19","opp":{"id":"24c7e91a-f7e6-4bd1-90ba-7caaba91302f","name":"Belton","seed":null,"score":2},"gf":0,"ga":2,"res":"L","pk":null}],"reachedRound":0,"reached":"Bi-District","result":"eliminated","depth":0.0}
  ]
}
