{
  "schema": 1,
  "_meta": {"source":"maxpreps","url":"https://www.maxpreps.com/tx/frisco/panther-creek-panthers","asOf":null},
  "id": "ba4ec0a4-7fa6-473e-967b-7a68ca169609",
  "name": "Panther Creek",
  "fullName": null,
  "city": "Frisco",
  "state": "TX",
  "maxpreps": "https://www.maxpreps.com/tx/frisco/panther-creek-panthers",
  "summary": {"appearances":1,"titles":0,"finals":0,"w":0,"l":1,"d":0},
  "best": {"season":"2025-26","competition":"tx-uil","division":"4a-d2","divisionLabel":"Conference 4A D2","result":"eliminated","reached":"Bi-District"},
  "appearances": [
    {"season":"2025-26","state":"TX","competition":"tx-uil","division":"4a-d2","divisionLabel":"Conference 4A D2","gender":"girls","seed":null,"rounds":6,"w":0,"l":1,"d":0,"gf":0,"ga":3,"games":[{"round":0,"roundName":"Bi-District","date":"2026-03-19","opp":{"id":"7deffa9d-584c-4aaa-8cc1-90ae6760efe5","name":"Sunnyvale","seed":null,"score":3},"gf":0,"ga":3,"res":"L","pk":null}],"reachedRound":0,"reached":"Bi-District","result":"eliminated","depth":0.0}
  ]
}
