{
  "schema": 1,
  "_meta": {"source":"maxpreps","url":"https://www.maxpreps.com/fl/winter-park/winter-park-wildcats","asOf":null},
  "id": "7089b33f-e75e-41b8-8472-ea12c14d409c",
  "name": "Winter Park",
  "fullName": null,
  "city": "Winter Park",
  "state": "FL",
  "maxpreps": "https://www.maxpreps.com/fl/winter-park/winter-park-wildcats",
  "summary": {"appearances":1,"titles":0,"finals":0,"w":1,"l":1,"d":0},
  "best": {"season":"2025-26","competition":"fl-fhsaa","division":"7a","divisionLabel":"Class 7A","result":"eliminated","reached":"Region Semifinal"},
  "appearances": [
    {"season":"2025-26","state":"FL","competition":"fl-fhsaa","division":"7a","divisionLabel":"Class 7A","gender":"girls","seed":6,"rounds":5,"w":1,"l":1,"d":0,"gf":3,"ga":2,"games":[{"round":0,"roundName":"Region Quarterfinal","date":"2026-02-05","opp":{"id":"a7629b1e-6750-429b-8623-07aa45cecd78","name":"West Orange","seed":3,"score":0},"gf":3,"ga":0,"res":"W","pk":null},{"round":1,"roundName":"Region Semifinal","date":"2026-02-11","opp":{"id":"a7bcd97d-9463-40b3-818f-c37e91c68f6f","name":"Creekside","seed":2,"score":2},"gf":0,"ga":2,"res":"L","pk":null}],"reachedRound":1,"reached":"Region Semifinal","result":"eliminated","depth":0.2}
  ]
}
