{
  "schema": 1,
  "_meta": {"source":"maxpreps","url":"https://www.maxpreps.com/ca/fillmore/fillmore-flashes","asOf":null},
  "id": "429328a8-e18e-48d6-8b38-509d8e03ab03",
  "name": "Fillmore",
  "fullName": null,
  "city": "Fillmore",
  "state": "CA",
  "maxpreps": "https://www.maxpreps.com/ca/fillmore/fillmore-flashes",
  "summary": {"appearances":1,"titles":0,"finals":1,"w":2,"l":1,"d":0},
  "best": {"season":"2017-18","competition":"ca-cif-socal","division":"gd5","divisionLabel":"Division 5","result":"runner-up","reached":"Regional Final"},
  "appearances": [
    {"season":"2017-18","state":"CA","competition":"ca-cif-socal","division":"gd5","divisionLabel":"Division 5","gender":"girls","seed":3,"rounds":3,"w":2,"l":1,"d":0,"gf":10,"ga":3,"games":[{"round":0,"roundName":"Round I","date":"2018-03-06","opp":{"id":"f4344874-0eb2-4c23-aa5f-4322013af0d1","name":"Rosamond","seed":6,"score":0},"gf":7,"ga":0,"res":"W","pk":null},{"round":1,"roundName":"Regional Semi-Finals","date":"2018-03-08","opp":{"id":"72544e43-a5ef-4174-86a4-173178a1db95","name":"Rialto","seed":2,"score":1},"gf":2,"ga":1,"res":"W","pk":null},{"round":2,"roundName":"Regional Final","date":"2018-03-10","opp":{"id":"c06b18c8-19c8-4573-8377-a9a33e932ad6","name":"San Gabriel Mission","seed":1,"score":2},"gf":1,"ga":2,"res":"L","pk":null}],"reachedRound":2,"reached":"Regional Final","result":"runner-up","depth":0.667}
  ]
}
