{
  "schema": 1,
  "_meta": {"source":"maxpreps","url":"https://www.maxpreps.com/tx/richmond/randle-lions","asOf":null},
  "id": "8edeaac4-5a9e-450d-afb3-699ea6fbb4dd",
  "name": "Randle",
  "fullName": null,
  "city": "Richmond",
  "state": "TX",
  "maxpreps": "https://www.maxpreps.com/tx/richmond/randle-lions",
  "summary": {"appearances":1,"titles":0,"finals":0,"w":0,"l":1,"d":0},
  "best": {"season":"2025-26","competition":"tx-uil","division":"5a-d2","divisionLabel":"Conference 5A D2","result":"eliminated","reached":"Bi-District"},
  "appearances": [
    {"season":"2025-26","state":"TX","competition":"tx-uil","division":"5a-d2","divisionLabel":"Conference 5A D2","gender":"girls","seed":null,"rounds":6,"w":0,"l":1,"d":0,"gf":2,"ga":3,"games":[{"round":0,"roundName":"Bi-District","date":"2026-03-19","opp":{"id":"96a7ae1b-137f-4755-baee-2e35ca68259e","name":"Galena Park","seed":null,"score":3},"gf":2,"ga":3,"res":"L","pk":null}],"reachedRound":0,"reached":"Bi-District","result":"eliminated","depth":0.0}
  ]
}
