{
  "schema": 1,
  "_meta": {"source":"maxpreps","url":"https://www.maxpreps.com/tx/houston/memorial-mustangs","asOf":null},
  "id": "e78f7230-8c7b-4582-aa8c-aa1fa20c34fb",
  "name": "Memorial",
  "fullName": null,
  "city": "Houston",
  "state": "TX",
  "maxpreps": "https://www.maxpreps.com/tx/houston/memorial-mustangs",
  "summary": {"appearances":1,"titles":0,"finals":0,"w":1,"l":1,"d":0},
  "best": {"season":"2025-26","competition":"tx-uil","division":"6a-d2","divisionLabel":"Conference 6A D2","result":"eliminated","reached":"Area"},
  "appearances": [
    {"season":"2025-26","state":"TX","competition":"tx-uil","division":"6a-d2","divisionLabel":"Conference 6A D2","gender":"girls","seed":null,"rounds":6,"w":1,"l":1,"d":0,"gf":11,"ga":4,"games":[{"round":0,"roundName":"Bi-District","date":"2026-03-19","opp":{"id":"6d023138-4e48-4cc0-b8de-0111563c40eb","name":"Heights","seed":null,"score":0},"gf":8,"ga":0,"res":"W","pk":null},{"round":1,"roundName":"Area","date":"2026-03-23","opp":{"id":"b4965d0e-831a-43a8-a37d-3943386aca73","name":"Tompkins","seed":null,"score":4},"gf":3,"ga":4,"res":"L","pk":null}],"reachedRound":1,"reached":"Area","result":"eliminated","depth":0.167}
  ]
}
