{
  "schema": 1,
  "_meta": {"source":"maxpreps","url":"https://www.maxpreps.com/ga/atlanta/galloway-scots","asOf":null},
  "id": "b25134c6-9a0a-48bb-b87a-2cc630311082",
  "name": "Galloway",
  "fullName": null,
  "city": "Atlanta",
  "state": "GA",
  "maxpreps": "https://www.maxpreps.com/ga/atlanta/galloway-scots",
  "summary": {"appearances":1,"titles":0,"finals":0,"w":0,"l":1,"d":0},
  "best": {"season":"2025-26","competition":"ga-ghsa","division":"private","divisionLabel":"Class Private","result":"eliminated","reached":"Round 1"},
  "appearances": [
    {"season":"2025-26","state":"GA","competition":"ga-ghsa","division":"private","divisionLabel":"Class Private","gender":"girls","seed":null,"rounds":5,"w":0,"l":1,"d":0,"gf":2,"ga":3,"games":[{"round":0,"roundName":"Round 1","date":"2026-04-23","opp":{"id":"b8dde8ae-9a24-430a-a51f-a4998e7d6d0f","name":"Athens Academy","seed":null,"score":3},"gf":2,"ga":3,"res":"L","pk":null}],"reachedRound":0,"reached":"Round 1","result":"eliminated","depth":0.0}
  ]
}
