{
  "schema": 1,
  "_meta": {"source":"maxpreps","url":"https://www.maxpreps.com/ga/dunwoody/dunwoody-wildcats","asOf":null},
  "id": "6f1efacb-8150-4f51-a6db-a6fc00f84f2f",
  "name": "Dunwoody",
  "fullName": null,
  "city": "Dunwoody",
  "state": "GA",
  "maxpreps": "https://www.maxpreps.com/ga/dunwoody/dunwoody-wildcats",
  "summary": {"appearances":1,"titles":0,"finals":0,"w":0,"l":1,"d":0},
  "best": {"season":"2025-26","competition":"ga-ghsa","division":"aaaaa","divisionLabel":"Class AAAAA","result":"eliminated","reached":"Round 1"},
  "appearances": [
    {"season":"2025-26","state":"GA","competition":"ga-ghsa","division":"aaaaa","divisionLabel":"Class AAAAA","gender":"girls","seed":null,"rounds":5,"w":0,"l":1,"d":0,"gf":0,"ga":3,"games":[{"round":0,"roundName":"Round 1","date":"2026-04-21","opp":{"id":"3b8420d2-102a-46cf-80e1-afef0ff020af","name":"Roswell","seed":null,"score":3},"gf":0,"ga":3,"res":"L","pk":null}],"reachedRound":0,"reached":"Round 1","result":"eliminated","depth":0.0}
  ]
}
