{
  "schema": 1,
  "_meta": {"source":"maxpreps","url":"https://www.maxpreps.com/tx/crockett/crockett-bulldogs","asOf":null},
  "id": "4ac83942-3f6e-49df-9d55-5a39e9865f1c",
  "name": "Crockett",
  "fullName": null,
  "city": "Crockett",
  "state": "TX",
  "maxpreps": "https://www.maxpreps.com/tx/crockett/crockett-bulldogs",
  "summary": {"appearances":1,"titles":0,"finals":0,"w":0,"l":1,"d":0},
  "best": {"season":"2025-26","competition":"tx-uil","division":"4a-d2","divisionLabel":"Conference 4A D2","result":"eliminated","reached":"Bi-District"},
  "appearances": [
    {"season":"2025-26","state":"TX","competition":"tx-uil","division":"4a-d2","divisionLabel":"Conference 4A D2","gender":"girls","seed":null,"rounds":6,"w":0,"l":1,"d":0,"gf":0,"ga":4,"games":[{"round":0,"roundName":"Bi-District","date":"2026-03-19","opp":{"id":"5bc33aef-453d-4fa9-9f98-ddf0ba27add0","name":"Henderson","seed":null,"score":4},"gf":0,"ga":4,"res":"L","pk":null}],"reachedRound":0,"reached":"Bi-District","result":"eliminated","depth":0.0}
  ]
}
