{
  "schema": 1,
  "_meta": {"source":"maxpreps","url":"https://www.maxpreps.com/tx/cypress/cy-fair-bobcats","asOf":null},
  "id": "e4b144de-8fbd-443d-aeaa-95f3058e7a41",
  "name": "Cy-Fair",
  "fullName": null,
  "city": "Cypress",
  "state": "TX",
  "maxpreps": "https://www.maxpreps.com/tx/cypress/cy-fair-bobcats",
  "summary": {"appearances":1,"titles":0,"finals":0,"w":0,"l":1,"d":1},
  "best": {"season":"2025-26","competition":"tx-uil","division":"6a-d1","divisionLabel":"Conference 6A D1","result":"eliminated","reached":"Area"},
  "appearances": [
    {"season":"2025-26","state":"TX","competition":"tx-uil","division":"6a-d1","divisionLabel":"Conference 6A D1","gender":"girls","seed":null,"rounds":6,"w":0,"l":1,"d":1,"gf":0,"ga":3,"games":[{"round":0,"roundName":"Bi-District","date":"2026-03-19","opp":{"id":"4ff33aa0-038a-4a79-8e4a-4958d23f76c1","name":"Bellaire","seed":null,"score":0},"gf":0,"ga":0,"res":"D","pk":"W"},{"round":1,"roundName":"Area","date":"2026-03-23","opp":{"id":"2d51e95d-195b-45d7-94df-142e494effca","name":"Seven Lakes","seed":null,"score":3},"gf":0,"ga":3,"res":"L","pk":null}],"reachedRound":1,"reached":"Area","result":"eliminated","depth":0.167}
  ]
}
