{
  "schema": 1,
  "_meta": {"source":"maxpreps","url":"https://www.maxpreps.com/tx/san-antonio/warren-warriors","asOf":null},
  "id": "27499ee4-4dfa-4420-9541-1df0cc752365",
  "name": "Warren",
  "fullName": null,
  "city": "San Antonio",
  "state": "TX",
  "maxpreps": "https://www.maxpreps.com/tx/san-antonio/warren-warriors",
  "summary": {"appearances":1,"titles":0,"finals":0,"w":1,"l":1,"d":0},
  "best": {"season":"2025-26","competition":"tx-uil","division":"6a-d1","divisionLabel":"Conference 6A D1","result":"eliminated","reached":"Area"},
  "appearances": [
    {"season":"2025-26","state":"TX","competition":"tx-uil","division":"6a-d1","divisionLabel":"Conference 6A D1","gender":"girls","seed":null,"rounds":6,"w":1,"l":1,"d":0,"gf":3,"ga":3,"games":[{"round":0,"roundName":"Bi-District","date":"2026-03-19","opp":{"id":"b7b35422-9c70-4ec0-8922-411f884029c8","name":"Johnson","seed":null,"score":1},"gf":2,"ga":1,"res":"W","pk":null},{"round":1,"roundName":"Area","date":"2026-03-23","opp":{"id":"e095cff2-1a68-48bf-a8cb-7c85ea824e67","name":"Lake Travis","seed":null,"score":2},"gf":1,"ga":2,"res":"L","pk":null}],"reachedRound":1,"reached":"Area","result":"eliminated","depth":0.167}
  ]
}
