{
  "schema": 1,
  "_meta": {"source":"maxpreps","url":"https://www.maxpreps.com/fl/jensen-beach/jensen-beach-falcons","asOf":null},
  "id": "654fa607-c594-4a6e-83e5-80ea94066892",
  "name": "Jensen Beach",
  "fullName": null,
  "city": "Jensen Beach",
  "state": "FL",
  "maxpreps": "https://www.maxpreps.com/fl/jensen-beach/jensen-beach-falcons",
  "summary": {"appearances":1,"titles":0,"finals":0,"w":0,"l":1,"d":0},
  "best": {"season":"2025-26","competition":"fl-fhsaa","division":"5a","divisionLabel":"Class 5A","result":"eliminated","reached":"Region Quarterfinal"},
  "appearances": [
    {"season":"2025-26","state":"FL","competition":"fl-fhsaa","division":"5a","divisionLabel":"Class 5A","gender":"girls","seed":6,"rounds":5,"w":0,"l":1,"d":0,"gf":0,"ga":8,"games":[{"round":0,"roundName":"Region Quarterfinal","date":"2026-02-05","opp":{"id":"c818ef46-6347-402a-8ce5-e98ac2f1a8f0","name":"Pembroke Pines Charter","seed":3,"score":8},"gf":0,"ga":8,"res":"L","pk":null}],"reachedRound":0,"reached":"Region Quarterfinal","result":"eliminated","depth":0.0}
  ]
}
