{
  "schema": 1,
  "_meta": {"source":"maxpreps","url":"https://www.maxpreps.com/tx/sunnyvale/sunnyvale-raiders","asOf":null},
  "id": "7deffa9d-584c-4aaa-8cc1-90ae6760efe5",
  "name": "Sunnyvale",
  "fullName": null,
  "city": "Sunnyvale",
  "state": "TX",
  "maxpreps": "https://www.maxpreps.com/tx/sunnyvale/sunnyvale-raiders",
  "summary": {"appearances":1,"titles":0,"finals":1,"w":5,"l":1,"d":0},
  "best": {"season":"2025-26","competition":"tx-uil","division":"4a-d2","divisionLabel":"Conference 4A D2","result":"runner-up","reached":"State Finals"},
  "appearances": [
    {"season":"2025-26","state":"TX","competition":"tx-uil","division":"4a-d2","divisionLabel":"Conference 4A D2","gender":"girls","seed":null,"rounds":6,"w":5,"l":1,"d":0,"gf":24,"ga":7,"games":[{"round":0,"roundName":"Bi-District","date":"2026-03-19","opp":{"id":"ba4ec0a4-7fa6-473e-967b-7a68ca169609","name":"Panther Creek","seed":null,"score":0},"gf":3,"ga":0,"res":"W","pk":null},{"round":1,"roundName":"Area","date":"2026-03-23","opp":{"id":"2ca3712c-3b97-4458-9d65-3d773dad62ea","name":"Pinkston","seed":null,"score":0},"gf":10,"ga":0,"res":"W","pk":null},{"round":2,"roundName":"Regional Semifinals","date":"2026-03-26","opp":{"id":"ffe8f067-c164-4c5b-a98f-3e86501961de","name":"Athens","seed":null,"score":1},"gf":5,"ga":1,"res":"W","pk":null},{"round":3,"roundName":"Regional Finals","date":"2026-03-30","opp":{"id":"a4007d35-8ff9-4e24-bff1-afb9768d5018","name":"Aubrey","seed":null,"score":2},"gf":3,"ga":2,"res":"W","pk":null},{"round":4,"roundName":"State Semifinals","date":"2026-04-02","opp":{"id":"fdf9f6b0-e6aa-4720-ae84-63788667b1a7","name":"Godley","seed":null,"score":1},"gf":2,"ga":1,"res":"W","pk":null},{"round":5,"roundName":"State Finals","date":"2026-04-09","opp":{"id":"4ccbc2a2-3669-4d67-b443-6c78dc0df118","name":"Wimberley","seed":null,"score":3},"gf":1,"ga":3,"res":"L","pk":null}],"reachedRound":5,"reached":"State Finals","result":"runner-up","depth":0.833}
  ]
}
