{
  "schema": 1,
  "_meta": {"source":"maxpreps","url":"https://www.maxpreps.com/tx/texarkana/pleasant-grove-hawks","asOf":null},
  "id": "15a3300a-e76c-4db1-8e77-79b1fc070602",
  "name": "Pleasant Grove",
  "fullName": null,
  "city": "Texarkana",
  "state": "TX",
  "maxpreps": "https://www.maxpreps.com/tx/texarkana/pleasant-grove-hawks",
  "summary": {"appearances":1,"titles":0,"finals":0,"w":0,"l":1,"d":0},
  "best": {"season":"2025-26","competition":"tx-uil","division":"4a-d2","divisionLabel":"Conference 4A D2","result":"eliminated","reached":"Bi-District"},
  "appearances": [
    {"season":"2025-26","state":"TX","competition":"tx-uil","division":"4a-d2","divisionLabel":"Conference 4A D2","gender":"girls","seed":null,"rounds":6,"w":0,"l":1,"d":0,"gf":3,"ga":5,"games":[{"round":0,"roundName":"Bi-District","date":"2026-03-19","opp":{"id":"b681a560-6341-4390-86ed-1e2afb24fcda","name":"Brownsboro","seed":null,"score":5},"gf":3,"ga":5,"res":"L","pk":null}],"reachedRound":0,"reached":"Bi-District","result":"eliminated","depth":0.0}
  ]
}
