{
  "schema": 1,
  "_meta": {"source":"maxpreps","url":"https://www.maxpreps.com/fl/gulf-breeze/gulf-breeze-dolphins","asOf":null},
  "id": "3225b375-e31b-4769-92f4-bb0c22580a47",
  "name": "Gulf Breeze",
  "fullName": null,
  "city": "Gulf Breeze",
  "state": "FL",
  "maxpreps": "https://www.maxpreps.com/fl/gulf-breeze/gulf-breeze-dolphins",
  "summary": {"appearances":1,"titles":0,"finals":0,"w":1,"l":1,"d":0},
  "best": {"season":"2025-26","competition":"fl-fhsaa","division":"5a","divisionLabel":"Class 5A","result":"eliminated","reached":"Region Semifinal"},
  "appearances": [
    {"season":"2025-26","state":"FL","competition":"fl-fhsaa","division":"5a","divisionLabel":"Class 5A","gender":"girls","seed":4,"rounds":5,"w":1,"l":1,"d":0,"gf":4,"ga":3,"games":[{"round":0,"roundName":"Region Quarterfinal","date":"2026-02-05","opp":{"id":"2d16a5bc-9a51-41b3-9110-bc24500a2e37","name":"Mosley","seed":5,"score":1},"gf":3,"ga":1,"res":"W","pk":null},{"round":1,"roundName":"Region Semifinal","date":"2026-02-11","opp":{"id":"ef2494bc-baf8-41bc-a48e-89f61d31c557","name":"Ponte Vedra","seed":1,"score":2},"gf":1,"ga":2,"res":"L","pk":null}],"reachedRound":1,"reached":"Region Semifinal","result":"eliminated","depth":0.2}
  ]
}
