{
  "schema": 1,
  "_meta": {"source":"maxpreps","url":"https://www.maxpreps.com/ca/granite-bay/granite-bay-grizzlies","asOf":null},
  "id": "1d925979-4b0f-4e53-a5d3-848ea1c06834",
  "name": "Granite Bay",
  "fullName": "Granite Bay Grizzlies",
  "city": "Granite Bay",
  "state": "CA",
  "maxpreps": "https://www.maxpreps.com/ca/granite-bay/granite-bay-grizzlies",
  "summary": {"appearances":5,"titles":1,"finals":3,"w":7,"l":4,"d":1},
  "best": {"season":"2024-25","competition":"ca-cif-norcal","division":"gd2","divisionLabel":"Division 2","result":"champion","reached":"Regional Final"},
  "appearances": [
    {"season":"2017-18","state":"CA","competition":"ca-cif-norcal","division":"gd1","divisionLabel":"Division 1","gender":"girls","seed":6,"rounds":3,"w":0,"l":1,"d":1,"gf":1,"ga":5,"games":[{"round":0,"roundName":"Round I","date":"2018-03-06","opp":{"id":"09beba1b-240a-45b8-aa6e-281decefa275","name":"Mountain View","seed":3,"score":1},"gf":1,"ga":1,"res":"D","pk":"W"},{"round":1,"roundName":"Regional Semi-Finals","date":"2018-03-08","opp":{"id":"0f63870a-34f3-4d5b-9dbf-653c8410f969","name":"Archbishop Mitty","seed":2,"score":4},"gf":0,"ga":4,"res":"L","pk":null}],"reachedRound":1,"reached":"Regional Semi-Finals","result":"eliminated","depth":0.333},
    {"season":"2018-19","state":"CA","competition":"ca-cif-norcal","division":"gd1","divisionLabel":"Division 1","gender":"girls","seed":5,"rounds":3,"w":0,"l":1,"d":0,"gf":0,"ga":1,"games":[{"round":0,"roundName":"Round I","date":"2019-02-26","opp":{"id":"594e7f5d-3e25-480c-bc2c-c15cbf09c737","name":"San Ramon Valley","seed":4,"score":1},"gf":0,"ga":1,"res":"L","pk":null}],"reachedRound":0,"reached":"Round I","result":"eliminated","depth":0.0},
    {"season":"2021-22","state":"CA","competition":"ca-cif-norcal","division":"gd2","divisionLabel":"Division 2","gender":"girls","seed":1,"rounds":3,"w":2,"l":1,"d":0,"gf":7,"ga":2,"games":[{"round":0,"roundName":"Round I","date":"2022-03-01","opp":{"id":"63d21af8-a741-43a9-aab6-075da3411957","name":"Sanger","seed":8,"score":1},"gf":4,"ga":1,"res":"W","pk":null},{"round":1,"roundName":"Regional Semifinals","date":"2022-03-03","opp":{"id":"b35c2fcd-db5f-447c-b41b-a4fa58b5c0be","name":"Christian Brothers","seed":4,"score":0},"gf":3,"ga":0,"res":"W","pk":null},{"round":2,"roundName":"Regional Final","date":"2022-03-05","opp":{"id":"bd6662e8-a2ee-45ca-b0e8-dd03dec005c9","name":"Leigh","seed":3,"score":1},"gf":0,"ga":1,"res":"L","pk":null}],"reachedRound":2,"reached":"Regional Final","result":"runner-up","depth":0.667},
    {"season":"2023-24","state":"CA","competition":"ca-cif-norcal","division":"gd2","divisionLabel":"Division 2","gender":"girls","seed":7,"rounds":3,"w":2,"l":1,"d":0,"gf":5,"ga":3,"games":[{"round":0,"roundName":"Round I","date":"2024-02-27","opp":{"id":"7298608f-2310-4399-aa07-d6bc50df3f4e","name":"Tamalpais","seed":2,"score":0},"gf":2,"ga":0,"res":"W","pk":null},{"round":1,"roundName":"Regional Semifinals","date":"2024-02-29","opp":{"id":"a34f251c-c120-40b8-b1ef-d17d0e8baa69","name":"Las Lomas","seed":6,"score":2},"gf":3,"ga":2,"res":"W","pk":null},{"round":2,"roundName":"Regional Final","date":"2024-03-02","opp":{"id":"aa03a009-dae4-4fec-8061-b1b804a31e12","name":"St. Francis","seed":1,"score":1},"gf":0,"ga":1,"res":"L","pk":null}],"reachedRound":2,"reached":"Regional Final","result":"runner-up","depth":0.667},
    {"season":"2024-25","state":"CA","competition":"ca-cif-norcal","division":"gd2","divisionLabel":"Division 2","gender":"girls","seed":1,"rounds":3,"w":3,"l":0,"d":0,"gf":3,"ga":0,"games":[{"round":0,"roundName":"Round I","date":"2025-03-04","opp":{"id":"738a2432-7acb-4ad6-b041-115ec0f331c2","name":"Homestead","seed":8,"score":0},"gf":1,"ga":0,"res":"W","pk":null},{"round":1,"roundName":"Regional Semifinals","date":"2025-03-06","opp":{"id":"ad47af1b-1b44-42d7-ac0e-a495ff09a7e7","name":"Cardinal Newman","seed":4,"score":0},"gf":1,"ga":0,"res":"W","pk":null},{"round":2,"roundName":"Regional Final","date":"2025-03-08","opp":{"id":"9f489fa8-a23a-4924-a2a0-5c5cff3c0fdc","name":"Marin Academy","seed":6,"score":0},"gf":1,"ga":0,"res":"W","pk":null}],"reachedRound":2,"reached":"Regional Final","result":"champion","depth":1.0}
  ]
}
