{
  "schema": 1,
  "_meta": {"source":"maxpreps","url":"https://www.maxpreps.com/fl/fort-lauderdale/nsu-university-sharks","asOf":null},
  "id": "b14f1bcd-df00-4ede-867d-1d1ed9d13484",
  "name": "NSU University",
  "fullName": null,
  "city": "Fort Lauderdale",
  "state": "FL",
  "maxpreps": "https://www.maxpreps.com/fl/fort-lauderdale/nsu-university-sharks",
  "summary": {"appearances":1,"titles":0,"finals":0,"w":1,"l":1,"d":0},
  "best": {"season":"2025-26","competition":"fl-fhsaa","division":"3a","divisionLabel":"Class 3A","result":"eliminated","reached":"Region Semifinal"},
  "appearances": [
    {"season":"2025-26","state":"FL","competition":"fl-fhsaa","division":"3a","divisionLabel":"Class 3A","gender":"girls","seed":4,"rounds":5,"w":1,"l":1,"d":0,"gf":4,"ga":1,"games":[{"round":0,"roundName":"Region Quarterfinal","date":"2026-02-02","opp":{"id":"5a6e5723-2665-42cd-a003-de5d33e6993e","name":"Coral Springs Charter","seed":5,"score":0},"gf":4,"ga":0,"res":"W","pk":null},{"round":1,"roundName":"Region Semifinal","date":"2026-02-09","opp":{"id":"a9ee1067-a30a-4c45-91f1-a259ea15101f","name":"Cardinal Gibbons","seed":1,"score":1},"gf":0,"ga":1,"res":"L","pk":null}],"reachedRound":1,"reached":"Region Semifinal","result":"eliminated","depth":0.2}
  ]
}
