{
  "schema": 1,
  "_meta": {"source":"maxpreps","url":"https://www.maxpreps.com/ga/atlanta/mount-vernon-mustangs","asOf":null},
  "id": "5839dcaa-281e-4660-879a-3aed0d909343",
  "name": "Mount Vernon",
  "fullName": null,
  "city": "Atlanta",
  "state": "GA",
  "maxpreps": "https://www.maxpreps.com/ga/atlanta/mount-vernon-mustangs",
  "summary": {"appearances":1,"titles":0,"finals":0,"w":1,"l":1,"d":0},
  "best": {"season":"2025-26","competition":"ga-ghsa","division":"private","divisionLabel":"Class Private","result":"eliminated","reached":"Round 2"},
  "appearances": [
    {"season":"2025-26","state":"GA","competition":"ga-ghsa","division":"private","divisionLabel":"Class Private","gender":"girls","seed":null,"rounds":5,"w":1,"l":1,"d":0,"gf":6,"ga":6,"games":[{"round":0,"roundName":"Round 1","date":"2026-04-23","opp":{"id":"fe339cf5-a010-44c3-892a-d3fd01fb8f1f","name":"Atlanta International","seed":null,"score":3},"gf":4,"ga":3,"res":"W","pk":null},{"round":1,"roundName":"Round 2","date":"2026-04-30","opp":{"id":"b3c32ce0-3484-4e22-b4e3-ca8c31776f5a","name":"Lovett","seed":null,"score":3},"gf":2,"ga":3,"res":"L","pk":null}],"reachedRound":1,"reached":"Round 2","result":"eliminated","depth":0.2}
  ]
}
