{
  "schema": 1,
  "_meta": {"source":"maxpreps","url":"https://www.maxpreps.com/ga/douglasville/douglas-county-tigers","asOf":null},
  "id": "48ebfb9a-f8c8-4c0b-b6dd-08292a623230",
  "name": "Douglas County",
  "fullName": null,
  "city": "Douglasville",
  "state": "GA",
  "maxpreps": "https://www.maxpreps.com/ga/douglasville/douglas-county-tigers",
  "summary": {"appearances":1,"titles":0,"finals":0,"w":0,"l":1,"d":0},
  "best": {"season":"2025-26","competition":"ga-ghsa","division":"aaaaaa","divisionLabel":"Class AAAAAA","result":"eliminated","reached":"Round 1"},
  "appearances": [
    {"season":"2025-26","state":"GA","competition":"ga-ghsa","division":"aaaaaa","divisionLabel":"Class AAAAAA","gender":"girls","seed":null,"rounds":5,"w":0,"l":1,"d":0,"gf":0,"ga":10,"games":[{"round":0,"roundName":"Round 1","date":"2026-04-23","opp":{"id":"f732444a-0c15-491f-b99f-bdda4104ec5c","name":"North Atlanta","seed":null,"score":10},"gf":0,"ga":10,"res":"L","pk":null}],"reachedRound":0,"reached":"Round 1","result":"eliminated","depth":0.0}
  ]
}
