{
  "schema": 1,
  "_meta": {"source":"maxpreps","url":"https://www.maxpreps.com/tx/zapata/zapata-hawks","asOf":null},
  "id": "53ead7c1-d313-4cb7-9157-0b33325ca281",
  "name": "Zapata",
  "fullName": null,
  "city": "Zapata",
  "state": "TX",
  "maxpreps": "https://www.maxpreps.com/tx/zapata/zapata-hawks",
  "summary": {"appearances":1,"titles":0,"finals":0,"w":0,"l":1,"d":0},
  "best": {"season":"2025-26","competition":"tx-uil","division":"4a-d2","divisionLabel":"Conference 4A D2","result":"eliminated","reached":"Bi-District"},
  "appearances": [
    {"season":"2025-26","state":"TX","competition":"tx-uil","division":"4a-d2","divisionLabel":"Conference 4A D2","gender":"girls","seed":null,"rounds":6,"w":0,"l":1,"d":0,"gf":0,"ga":12,"games":[{"round":0,"roundName":"Bi-District","date":"2026-03-19","opp":{"id":"41e931ec-a457-468d-a941-0626e246d95c","name":"London","seed":null,"score":12},"gf":0,"ga":12,"res":"L","pk":null}],"reachedRound":0,"reached":"Bi-District","result":"eliminated","depth":0.0}
  ]
}
